{
  "$schema": "https://json-schema.org/draft/2020-12/schema",
  "title": "Transform Dataset Manifest",
  "description": "Provenance and file inventory for a mokunet spatial transform dataset.",
  "type": "object",
  "required": ["id", "title", "authority", "downloaded_at", "zone_type", "files"],
  "properties": {
    "id": {
      "type": "string",
      "description": "Unique dataset identifier (kebab-case, matches directory name)"
    },
    "title": {
      "type": "string",
      "description": "Human-readable dataset title"
    },
    "description": {
      "type": "string",
      "description": "Brief description of the dataset contents and scope"
    },
    "authority": {
      "type": "object",
      "required": ["agency", "portal_url", "license", "update_frequency"],
      "properties": {
        "agency": { "type": "string", "description": "Authoritative agency or organization" },
        "portal": { "type": "string", "description": "Portal or program name" },
        "portal_url": { "type": "string", "format": "uri", "description": "URL to the dataset page on the source portal" },
        "license": { "type": "string", "description": "License or access terms (e.g., public-domain, CC-BY-4.0)" },
        "update_frequency": {
          "type": "string",
          "enum": ["static", "annual", "quarterly", "on-change"],
          "description": "How often the source portal updates this dataset"
        }
      }
    },
    "downloaded_at": {
      "type": "string",
      "format": "date",
      "description": "Date the source file was downloaded (YYYY-MM-DD)"
    },
    "source_vintage": {
      "type": "string",
      "description": "The reference year or version of the source data"
    },
    "last_checked": {
      "type": "string",
      "format": "date",
      "description": "Date the source portal was last checked for updates"
    },
    "stale": {
      "type": "boolean",
      "default": false,
      "description": "Set to true when a newer version is known to exist at the portal"
    },
    "coverage": {
      "type": "object",
      "properties": {
        "islands": {
          "type": "array",
          "items": { "type": "string" },
          "description": "Islands covered by this dataset"
        },
        "moku_ids": {
          "type": "array",
          "items": { "type": "string" },
          "description": "Specific moku IDs if dataset is moku-scoped"
        },
        "scope": { "type": "string", "description": "Geographic scope description" }
      }
    },
    "zone_type": {
      "type": "string",
      "description": "AuraDB Zone type value (e.g., ag, school, highway, environment)"
    },
    "h3_strategy": {
      "type": "string",
      "enum": ["centroid", "polyfill", "line-sample", "point-anchor", "none"],
      "description": "H3 cell generation strategy used by the generator script"
    },
    "h3_resolution": {
      "type": "integer",
      "minimum": 0,
      "maximum": 15,
      "description": "Primary H3 resolution used for zone cells"
    },
    "feature_count": {
      "type": "integer",
      "description": "Number of features/records in the source dataset"
    },
    "files": {
      "type": "object",
      "properties": {
        "source": {
          "type": "object",
          "required": ["file", "format", "tracked"],
          "properties": {
            "file": { "type": "string" },
            "format": { "type": "string", "enum": ["geojson", "csv", "json"] },
            "size_mb": { "type": "number" },
            "tracked": { "type": "boolean", "description": "Whether this file is tracked in git" },
            "download_url": { "type": "string", "format": "uri", "description": "Direct download URL for the source file" }
          }
        },
        "cleaned_csv": {
          "type": "object",
          "properties": {
            "file": { "type": "string" },
            "format": { "type": "string" },
            "rows": { "type": "integer" },
            "tracked": { "type": "boolean" },
            "extract_script": { "type": "string", "description": "Script that extracts this CSV from source (if derived)" }
          }
        },
        "h3_csv": {
          "type": "object",
          "properties": {
            "file": { "type": "string" },
            "format": { "type": "string" },
            "rows": { "type": "integer" },
            "tracked": { "type": "boolean" }
          }
        }
      }
    },
    "scripts": {
      "type": "object",
      "properties": {
        "generate": { "type": "string", "description": "H3 cell generator script (.mjs)" },
        "extract": { "type": "string", "description": "CSV extraction script (if source is GeoJSON)" },
        "stage_a": { "type": "string", "description": "Stage A Cypher: create Zone nodes" },
        "stage_b": { "type": "string", "description": "Stage B Cypher: load ZoneCells / IntraZones" },
        "loader": { "type": "string", "description": "Driver-based loader script (alternative to Stage A/B Cypher)" }
      }
    }
  }
}
