{
  "$schema": "../dataset-schema.json",
  "id": "state-land-use",
  "title": "State Land Use Districts (LUC)",
  "description": "906 HRS §205-2 state land use district polygons (urban/rural/agricultural/conservation) statewide, from the Land Use Commission via the Hawaii Statewide GIS Program. Res-8 polyfill stamps state_land_use_codes / primary_land_use onto backbone ZoneCells — the state axis of the AG12 two-axis siting gate. Regulation is read-only: boundaries are never authored or reinterpreted here (LUC holds sole authority, §205-49(c)).",
  "authority": {
    "agency": "State of Hawaii Land Use Commission",
    "portal": "Hawaii Statewide GIS Program",
    "portal_url": "https://geoportal.hawaii.gov/datasets/state-land-use-districts",
    "license": "public-domain",
    "update_frequency": "on-change"
  },
  "downloaded_at": "2026-08-11",
  "source_vintage": "2026",
  "last_checked": "2026-08-11",
  "stale": false,
  "coverage": {
    "islands": ["oahu", "maui", "hawaii", "kauai", "molokai", "lanai", "niihau", "kahoolawe"],
    "scope": "statewide"
  },
  "zone_type": "zoning",
  "h3_strategy": "polyfill",
  "h3_resolution": 8,
  "feature_count": 906,
  "files": {
    "source": {
      "file": "State_Land_Use_Districts.geojson",
      "format": "geojson",
      "size_mb": 6,
      "tracked": false,
      "download_url": "https://geodata.hawaii.gov/arcgis/rest/services/ParcelsZoning/MapServer/20/query?where=1%3D1&outFields=objectid,ludcode,island,acres&outSR=4326&geometryPrecision=6&f=geojson"
    },
    "cell_codes_csv": {
      "file": "SLUD_CellCodes_H3.csv",
      "format": "csv",
      "rows": 19568,
      "tracked": true
    }
  },
  "scripts": {
    "generate": "generate-slud-cell-codes.mjs",
    "stage_c": "load-slud-cell-codes.cypher"
  }
}
