{
  "$schema": "../dataset-schema.json",
  "id": "highways",
  "title": "Highway Performance Monitoring System Roads (HPMS)",
  "description": "2,075 road segments across all islands with AADT, functional system, facility type, and ownership data.",
  "authority": {
    "agency": "Hawaii Department of Transportation",
    "portal": "Hawaii Statewide GIS Program",
    "portal_url": "https://geoportal.hawaii.gov/datasets/highway-performance-monitoring-system-roads-for-hawaii",
    "license": "public-domain",
    "update_frequency": "annual"
  },
  "downloaded_at": "2026-02-22",
  "source_vintage": "2023",
  "last_checked": "2026-02-22",
  "stale": false,
  "coverage": {
    "islands": ["hawaii", "kauai", "maui", "oahu", "molokai", "lanai"],
    "scope": "statewide"
  },
  "zone_type": "highway",
  "h3_strategy": "centroid",
  "h3_resolution": 8,
  "feature_count": 2075,
  "files": {
    "source": {
      "file": "Highway_Performance_Monitoring_System_Roads_for_Hawaii_(HPMS).geojson",
      "format": "geojson",
      "size_mb": 3.7,
      "tracked": false,
      "download_url": "https://geoportal.hawaii.gov/datasets/highway-performance-monitoring-system-roads-for-hawaii/explore"
    },
    "cleaned_csv": {
      "file": "Highway_Performance_Monitoring_System_Roads_for_Hawaii_(HPMS).csv",
      "format": "csv",
      "rows": 2075,
      "tracked": true
    },
    "h3_csv": {
      "file": "HWY_Zones_H3.csv",
      "format": "csv",
      "rows": 2075,
      "tracked": true
    }
  },
  "scripts": {
    "generate": "generate-highways-h3.mjs",
    "stage_a": "create-highways-zones.cypher",
    "stage_b": "load-highways-zone-cells.cypher"
  }
}
